{
  "scenes": {
    "prologue": "【冷启动·引擎就绪】ygg 世界已装载（引擎 {{engine}}），此刻只有规则与一份待注入的任务描述。当前阶段 {{stage}}，演进模式 {{mode}}——这里是 M-Agent 的通用冷启动层：任何任务都从同一个起点开始。",
    "intake": "【等待立项】当前阶段 {{stage}}：没有任务、没有切片、没有门禁。你手里只有即将注入的任务描述——先把它压成一句目标（title）与一段边界（description）。门禁口径现在是 {{gates}}。",
    "decompose": "【任务已立项】任务《{{title}}》：{{description}}。下一步把它切成 {{min}}–{{max}} 片可独立验收的切片，每片都要能被一句 summary 说清。演进模式 {{mode}}。",
    "implement": "【切片执行】当前 {{next}}/{{count}}：`{{slice}}`（已完成 {{done}} 片：{{done_ids}}）。执行中每一片都要留下可复核的 summary 与产物路径，做完立刻上报，不要攒到最后。",
    "verify": "【门禁自检】{{count}} 片全部上报（{{done_ids}}）。上一次门禁记录：{{verify_state}}；历史失败 {{failures}} 次。当前门禁口径 {{gates}}。",
    "review": "【局末复盘】任务《{{title}}》：{{count}} 片全部上报，门禁失败 {{failures}} 次，评分待记录。演进模式 {{mode}}。"
  },
  "endings": {
    "done": "【结局·本局收束】任务《{{title}}》—— {{count}} 片全部上报，门禁失败 {{failures}} 次，复盘评分 {{score}}/5，演进模式 {{mode}}。经验一句话：{{lesson}}"
  },
  "prompts": {
    "intake": "冷启动起点：你只有一份任务描述。提交它，还是先调整运行期配置？",
    "decompose": "任务已立项。给出切片计划，还是先调整配置？",
    "implement": "执行切片。上报完成，还是先调整策略？",
    "verify": "全部切片已上报。门禁结果如何？",
    "review": "局末复盘。记录经验并收口，还是先调整演进口径？"
  },
  "options": {
    "intake": "task.intake —— 注入任务描述 {title, description}（载荷 \"title|description\"）",
    "plan_submit": "plan.submit —— 提交切片计划 1–{{max}} 片（载荷 \"s1=标题; s2=标题; …\"）",
    "slice_report": "slice.report —— 上报切片 `{{id}}`（载荷 \"{{id}}|summary|artifacts\"）",
    "verify_green": "verify.submit all_green=true —— 门禁全绿，进复盘",
    "verify_fail": "verify.submit all_green=false —— 如实上报失败（载荷 \"all_green=false;report=…\"）",
    "review_note": "review.note —— 记录经验并收口（载荷 \"lesson|score(1-5)\"）",
    "config_evolution": "config.set —— 演进模式 {{mode}} → {{next}}（载荷 \"evolution.mode={{next}}\"）",
    "config_gates": "config.set —— 门禁 require_all_green {{state}} → {{next}}（载荷 \"gates.require_all_green={{next}}\"）"
  },
  "beats": {
    "prologue_guide": "你正在冷启动。当前允许的动作只有 pendingChoice 里列出的几项，选一个内核就推进一格；不在这张表里的动作会被拒绝且不改变状态。配置口径：演进 {{mode}}、门禁 {{gates}}——想改就先选 config.set。",
    "intake_guide": "你正在立项。把任务描述写成 \"title|description\" 一个字符串提交（竖线分隔；缺省部分自动补占位）。目标要一句话说完，边界要能挡住跑偏。",
    "decompose_guide": "你正在切片。切成 {{min}}–{{max}} 片，每片都必须能独立验收（一句话说清做了什么、怎么验证）。计划一旦提交就按序执行，不能跳片。",
    "implement_guide": "你正在执行切片 `{{slice_id}}`。做完立刻上报 slice.report：\"id|summary|artifacts\"（产物路径用半角逗号分隔）；顺序错了会被打回重报。当前策略口径：演进 {{mode}}。",
    "verify_guide": "你正在跑门禁。全绿就提交 all_green=true；有失败务必如实提交 all_green=false 并附 report——门禁口径 {{gates}}：要求全绿时失败会打回切片执行，宽放时失败也放行进复盘。",
    "review_guide": "你正在复盘。写一句能被下局直接复用的经验（lesson），给本局打 1–5 分（缺省 {{score}}），然后收口——这一局的世界就结束了。",
    "rejected": "【动作被拒】`{{action}}` 不属于当前阶段 {{stage}}。当前阶段允许的动作是：{{allowed}}。内核不会为一个越阶动作改变状态——回执后按 pendingChoice 重选。原因：{{detail}}",
    "rejected_payload": "【载荷被拒】`{{action}}` 在当前阶段 {{stage}} 是允许的动作，但这次载荷无法接受：{{detail}} 主状态未改变——修好载荷重发即可。",
    "rejected_default": "动作与当前阶段不符。",
    "stage_expected": "该动作只在 `{{expected}}` 阶段有效。",
    "allowed_none": "（局末，无可用动作）",
    "config_changed": "【配置变更】settings.{{key}} = {{value}}（作用：{{scope}}）。配置不改变主状态，只改变接下来如何推进——本回执后仍停在 {{stage}}。",
    "scope_evolution_mode": "决定局末复盘是否在白名单内自动修订 Mod",
    "scope_evolution_cap": "决定本局自动修订的次数上限",
    "scope_gates": "决定门禁失败是否打回切片执行",
    "scope_host": "宿主侧消费（内核不解释该值）",
    "config_keys": "evolution.mode / evolution.max_per_run / gates.require_all_green / autosave / hot_reload",
    "bad_config_key": "未知配置键 `{{key}}`：只接受 settings.* 命名空间下的 {{allowed}}。",
    "bad_config_value": "配置值不合法：settings.{{key}} = `{{value}}`（允许 {{allowed}}）。",
    "intake_ok": "已立项：任务《{{title}}》写入 kv，下一步切片。",
    "plan_ok": "计划已登记：{{ids}} 共 {{count}} 片，进入切片执行。",
    "bad_payload": "载荷形状不符（{{action}} 期望一个字符串载荷）。",
    "bad_slice_id": "切片 id 不合法：`{{id}}`（不得为空，且不得含 | ; = 三个分隔符）。",
    "dup_slice_id": "切片 id 重复：`{{id}}`。",
    "bad_slice_title": "切片 `{{id}}` 缺少标题。",
    "bad_slice_count": "切片数不合法：收到 {{count}} 片，允许 {{min}}–{{max}} 片。",
    "slice_order": "切片顺序要求下一个上报 `{{expected}}`（第 {{index}} 片），收到 `{{got}}`——乱序上报不推进进度。",
    "slice_ok": "切片 `{{id}}` 已上报（{{done}}/{{count}}）：{{summary}}",
    "slice_final": "全部 {{count}} 片上报完毕——进入门禁自检。",
    "verify_ok": "门禁全绿：{{count}} 片的工作按当前口径通过，进入局末复盘。",
    "verify_fail": "门禁失败（累计 {{failures}} 次）：已打回切片执行，重做切片 `{{slice_id}}` 后再自检。",
    "gate_bypass": "门禁失败（累计 {{failures}} 次），但门禁口径 {{gates}}——按配置放行进复盘（宽放路径）。",
    "bad_verify_payload": "门禁载荷不合法：`{{got}}`——用 true / false，或 \"all_green=true|false;report=…\"。",
    "verify_state_none": "无记录（本局尚未提交门禁）",
    "verify_green_record": "全绿（all_green=true）",
    "verify_failed_record": "失败（all_green=false，未附报告）",
    "default_gate_report": "（占位报告：门禁未通过，待修）",
    "review_ok": "复盘已记录：{{score}}/5 —— {{lesson}}",
    "bad_score": "评分不合法：`{{got}}`（要求 1–5 的整数）。",
    "bad_index": "【选项越界】当前阶段 {{stage}} 只有 {{count}} 个选项，收到 {{index}}——按 pendingChoice 重选。",
    "unknown_choice": "【局末】当前阶段 {{stage}} 已无待选动作，这次选择被忽略。",
    "unknown_stage": "【状态异常】KV 中的阶段 `{{stage}}` 不在六态表内，回落到冷启动起点（不静默死路）。",
    "evolution_auto": "演进 auto：本局已登记自动修订请求（白名单 {{paths}}，用量 {{used}}/{{cap}}），由宿主执行 revise；内核不直接改写 Mod 文件。",
    "evolution_auto_pending": "演进 auto 已就位，但本局入口那一刻的模式不是 auto：本局按报告收口，自动修订从下一局生效。",
    "evolution_suggest": "演进 suggest：已产出修订建议包（白名单 {{paths}}），等待人工采纳。",
    "evolution_off": "演进 off：仅产出报告，不改动任何 Mod 文件。",
    "evolution_capped": "演进 auto 但本局额度已用尽（{{cap}}/{{cap}}，白名单 {{paths}}）：本局只报告，不再修订。",
    "gate_strict": "要求全绿（gates.require_all_green=true）",
    "gate_lenient": "宽放（gates.require_all_green=false）",
    "none_done": "（暂无）",
    "no_slice": "（无待执行切片）",
    "paths_none": "（白名单未声明）",
    "default_task_title": "（未命名任务）",
    "default_task_desc": "（未提供任务描述：Agent 尚未注入真实需求，先按默认语义走通一次冷启动）",
    "default_plan": "环境就绪; 核心实现; 门禁自检",
    "default_summary": "本片按计划完成，自检通过（占位小结：真实执行时由 Agent 提交具体结论）",
    "default_artifacts": "docs/artifacts/slice-note.md",
    "default_lesson": "先切片再动手，比一口气写完更容易通过门禁。"
  },
  "tuning": {
    "min_slices": 1,
    "max_slices": 8,
    "default_score": 3
  }
}
